filename,text
en/us/180-inverted-turn-fca74fc8.wav,180 Degree Inverted Aerobatic Turn.
en/us/270-degree-roller-751d8c67.wav,"270 Degree Roller. Full roll inside, half roll outside."
en/us/270-roller-711e718a.wav,270 Degree Roller. Three full rolls inside.
en/us/45-downline-9fdb799f.wav,45 Downline.
en/us/90-degree-roller-2c40ae38.wav,90 Degree Roller. Full roll inside. Exit inverted.
en/us/bow-tie-a0d18cb9.wav,Bow Tie. Half roll on both 45 uplines. Exit inverted.
en/us/double-humpty-0399fb87.wav,"Double Humpty. Half roll on the downline, outside loop, three-quarter positive snap on the upline. Exit inverted."
en/us/double-humpty-d8156fd4.wav,"Double Humpty. Quarter roll on the upline, positive snap on the downline, quarter roll on top. Exit inverted."
en/us/down-fig-n-0f13642e.wav,Down Fig N. Two rolls on the 45 upline.
en/us/down-humpty-95e6a404.wav,"Down Humpty. Two quarter rolls on the downline, full roll on the upline."
en/us/down-humpty-bump-c7629585.wav,Down Humpty Bump. Three-quarter positive spin on entry. Exit inverted.
en/us/down-loop-47ee27c9.wav,"Down Loop. Outside loop, three-quarter opposite roll, one and three-quarter positive snaps at the bottom."
en/us/down-sharks-tooth-964556f5.wav,"Down Sharks Tooth. Three-quarter roll on the downline, two quarter rolls on the upline. Exit inverted."
en/us/down-sharks-tooth-spin-dea81b46.wav,Down Sharks Tooth. Two turn positive spin on entry.
en/us/fig-n-bf2b0a3d.wav,Fig N. Half roll on the inverted 45 downline. Exit inverted.
en/us/fig-p-958a6404.wav,"Fig P. Four-point roll on the upline, full roll at the top, positive snap on exit."
en/us/goldfish-632aaaa2.wav,Goldfish. Two quarter rolls on the 45 upline.
en/us/half-cuban-85915bfc.wav,"Half Cuban. Outside loop, half roll on the downline."
en/us/half-cuban-95ebc2d7.wav,"Half Cuban. Three-quarter opposite roll on the 45 upline, outside loop, half roll on exit. Exit inverted."
en/us/half-reverse-cuban-054bb707.wav,"Half Reverse Cuban. Push entry, half roll on the 45 downline, outside loop, three-quarter opposite roll on exit."
en/us/half-reverse-cuban-1a7c4305.wav,"Half Reverse Cuban. One and a half negative snaps on the downline, inside loop, half roll opposite half roll on exit. Exit inverted."
en/us/half-reverse-cuban-31ff3d3a.wav,"Half Reverse Cuban. One and a quarter roll, opposite quarter roll on the 45 upline. Inside loop. One and three-quarter positive snaps, opposite three-quarter roll on exit."
en/us/hammerhead-1f1567df.wav,"Hammerhead. Three-quarter roll, opposite three-quarter positive snap on the upline. Half roll on the downline. Exit inverted."
en/us/hammerhead-34648bf1.wav,Hammerhead.
en/us/hammerhead-4aca7f4d.wav,"Hammerhead. Half roll on the upline, three-quarter negative snap then three-quarter roll on the downline."
en/us/hammerhead-91769321.wav,"Hammerhead. Push entry, half roll on the upline, half roll on the downline, half roll to exit."
en/us/hammerhead-f3222b9a.wav,"Hammerhead. Half roll on the upline, half roll on the downline."
en/us/humpty-bump-49898ee5.wav,"Humpty Bump. Half roll on the upline, half roll on the downline."
en/us/humpty-e1786de6.wav,"Humpty. Half roll, opposite one and a half positive snaps on the upline. One and a quarter rolls on the downline."
en/us/immelmann-2da1159a.wav,"Immelmann. One and three-quarter rolls, opposite three-quarter positive snap on entry. Outside loop. Full roll opposite, full roll on exit."
en/us/immelmann-a5bf0b3d.wav,Immelmann. Half roll at the top.
en/us/laydown-humpty-1c72a6c9.wav,"Laydown Humpty. Full roll on the downline, half roll on the upline."
en/us/laydown-s-e5765e5a.wav,"Laydown S. Half roll on entry, outside loop, three-quarter negative snap and quarter roll on the 45, inside loop, four-point roll on exit."
en/us/loop-2c15cc05.wav,"Loop. Outside entry, three-quarter opposite roll and quarter roll at the top."
en/us/loop-6c260463.wav,Loop.
en/us/p-loop-c6f4cf89.wav,"P Loop. Two full rolls on entry, three-quarter inside loop, quarter roll on the downline."
en/us/q-loop-8fb90c0b.wav,Q Loop. Full roll integrated at the top. Exit on a 45 downline.
en/us/q-loop-cca0aa6d.wav,"Q Loop. Half roll on the upline, negative snap at the top, half roll on exit."
en/us/reset-aalt-3c5da9f0.wav,Advanced ALT sequence reset.
en/us/reset-advan-e7dc8744.wav,Advanced sequence reset.
en/us/reset-basic-8f5c0bd2.wav,Basic sequence reset.
en/us/reset-ialt-c8982ae3.wav,Intermediate ALT sequence reset.
en/us/reset-inter-7fef0d50.wav,Intermediate sequence reset.
en/us/reset-sport-8b330e32.wav,Sportsman sequence reset.
en/us/reset-ualt-c024eaab.wav,Unlimited ALT sequence reset.
en/us/reset-unlim-71fc1a67.wav,Unlimited sequence reset.
en/us/reverse-half-cuban-efc78948.wav,Reverse Half Cuban. Half roll on the 45 upline.
en/us/reverse-laydown-humpty-8b6a988d.wav,"Reverse Laydown Humpty. One and a half positive snaps, opposite one and a half rolls on the upline. Outside loop, half roll on the downline. Exit inverted."
en/us/reverse-laydown-humpty-9523f40a.wav,"Reverse Laydown Humpty. One and a half rolls on the upline, half roll on the downline. Exit inverted."
en/us/roll-28432ff9.wav,Roll.
en/us/sharks-tooth-c145242c.wav,"Sharks Tooth. One and a quarter roll, opposite quarter roll on the 45 upline. Half roll on the downline."
en/us/sharks-tooth-cfbced3a.wav,"Sharks Tooth. Three-quarter roll, three-quarter positive snap on the upline. Three-quarter roll, opposite three-quarter roll on the downline."
en/us/spin-29d9456c.wav,Spin. One and a half positive turns. Opposite one and three-quarter negative snaps. Exit upright.
en/us/spin-6de9190c.wav,"Spin. One and a half positive turns. Half roll opposite, push to exit inverted."
en/us/spin-7bdc9e6b.wav,"Spin. One and three-quarter inverted turns. Quarter roll, pull to exit upright."
en/us/split-s-2457d785.wav,Split S. Half roll to enter.
en/us/split-s-47b40932.wav,"Split S. Half roll to enter, positive snap on exit."
en/us/tear-drop-46f78217.wav,"Tear Drop. Three-quarter negative snap and quarter roll on the upline, positive snap at the bottom."
en/us/tear-drop-606745cb.wav,"Tear Drop. Quarter roll, opposite one and a quarter rolls on the upline, inside loop. Full roll, opposite negative snap on the downline. Exit inverted."
en/us/tear-drop-be0af6f7.wav,"Tear Drop. Quarter roll, opposite one and a quarter rolls on the upline, inside loop. Full roll, opposite three-quarter negative snap on the downline. Exit inverted."
en/us/vertical-down-line-f664794d.wav,Vertical Down Line. Half roll.
en/us/vertical-upline-d8766cad.wav,"Vertical Upline. Half roll, push to exit."
